{
  "$schema": "https://json-schema.org/draft/2020-12/schema",
  "$id": "https://abf.invalid/schemas/abf-meta-1.0.json",
  "title": "abf-meta-1.0",
  "description": "Metadata contract of one ABF layer or of the boundaries set (SPEC_META_publish_v0_1 section 3).",
  "type": "object",
  "additionalProperties": false,
  "required": [
    "schema_version",
    "kind",
    "layer_id",
    "title",
    "domain",
    "description",
    "fields",
    "sources",
    "license",
    "boundary_release",
    "freshness",
    "coverage",
    "download_formats",
    "release",
    "verification",
    "citation"
  ],
  "properties": {
    "schema_version": {
      "const": "abf-meta-1.0"
    },
    "kind": {
      "enum": [
        "layer",
        "boundaries"
      ]
    },
    "layer_id": {
      "type": "string",
      "pattern": "^[a-z][a-z0-9_]*$"
    },
    "title": {
      "type": "string",
      "minLength": 1
    },
    "title_ru": {
      "type": "string",
      "minLength": 1
    },
    "domain": {
      "enum": [
        "energy",
        "dc",
        "restrictions",
        "observability",
        "boundaries"
      ]
    },
    "level": {
      "enum": [
        "ADM0",
        "ADM1",
        "ADM2",
        "point",
        "line"
      ]
    },
    "levels": {
      "type": "array",
      "minItems": 1,
      "uniqueItems": true,
      "items": {
        "enum": [
          "ADM0",
          "ADM1",
          "ADM2"
        ]
      }
    },
    "description": {
      "type": "string",
      "minLength": 1
    },
    "fields": {
      "type": "array",
      "minItems": 1,
      "items": {
        "$ref": "#/$defs/field"
      }
    },
    "sources": {
      "type": "array",
      "minItems": 1,
      "items": {
        "$ref": "#/$defs/source"
      }
    },
    "license": {
      "$ref": "#/$defs/license"
    },
    "boundary_release": {
      "type": [
        "string",
        "null"
      ]
    },
    "freshness": {
      "$ref": "#/$defs/freshness"
    },
    "coverage": {
      "$ref": "#/$defs/coverage"
    },
    "download_formats": {
      "type": "array",
      "minItems": 1,
      "uniqueItems": true,
      "items": {
        "enum": [
          "parquet",
          "geojson.gz",
          "csv"
        ]
      }
    },
    "release": {
      "$ref": "#/$defs/release"
    },
    "verification": {
      "$ref": "#/$defs/verification"
    },
    "citation": {
      "$ref": "#/$defs/citation"
    },
    "display": {
      "$ref": "#/$defs/display"
    },
    "extra_files": {
      "type": "array",
      "items": {
        "$ref": "#/$defs/extra_file"
      }
    }
  },
  "allOf": [
    {
      "if": {
        "properties": {
          "kind": {
            "const": "layer"
          }
        }
      },
      "then": {
        "required": [
          "level"
        ],
        "not": {
          "required": [
            "levels"
          ]
        }
      }
    },
    {
      "if": {
        "properties": {
          "kind": {
            "const": "boundaries"
          }
        }
      },
      "then": {
        "required": [
          "levels"
        ],
        "not": {
          "required": [
            "level"
          ]
        }
      }
    }
  ],
  "$defs": {
    "date": {
      "type": "string",
      "pattern": "^\\d{4}-\\d{2}-\\d{2}$"
    },
    "datetime_utc": {
      "type": "string",
      "pattern": "^\\d{4}-\\d{2}-\\d{2}T\\d{2}:\\d{2}:\\d{2}Z$"
    },
    "sha256": {
      "type": "string",
      "pattern": "^[0-9a-f]{64}$"
    },
    "field": {
      "type": "object",
      "additionalProperties": false,
      "required": [
        "name",
        "type",
        "description",
        "nullable"
      ],
      "properties": {
        "name": {
          "type": "string",
          "pattern": "^[a-z][a-z0-9_]*$"
        },
        "type": {
          "enum": [
            "string",
            "integer",
            "number",
            "boolean",
            "date",
            "datetime"
          ]
        },
        "unit": {
          "type": "string"
        },
        "description": {
          "type": "string",
          "minLength": 1
        },
        "nullable": {
          "type": "boolean"
        },
        "null_meaning": {
          "anyOf": [
            {
              "type": "string",
              "minLength": 1
            },
            {
              "type": "object",
              "additionalProperties": false,
              "required": [
                "not_covered",
                "covered"
              ],
              "properties": {
                "not_covered": {
                  "type": "string",
                  "minLength": 1
                },
                "covered": {
                  "type": [
                    "string",
                    "null"
                  ]
                }
              }
            }
          ]
        }
      },
      "if": {
        "properties": {
          "nullable": {
            "const": true
          }
        }
      },
      "then": {
        "required": [
          "null_meaning"
        ]
      }
    },
    "license": {
      "type": "object",
      "additionalProperties": false,
      "required": [
        "id",
        "name",
        "url",
        "family",
        "attribution_text"
      ],
      "properties": {
        "id": {
          "type": "string",
          "minLength": 1
        },
        "name": {
          "type": "string",
          "minLength": 1
        },
        "url": {
          "type": "string",
          "minLength": 1
        },
        "family": {
          "enum": [
            "public_domain",
            "attribution",
            "share_alike",
            "not_publishable"
          ]
        },
        "attribution_text": {
          "type": "string",
          "minLength": 1
        }
      }
    },
    "rights_basis": {
      "type": "object",
      "additionalProperties": false,
      "required": [
        "type",
        "text",
        "checked_at",
        "checked_by",
        "evidence_url"
      ],
      "properties": {
        "type": {
          "enum": [
            "license",
            "statute",
            "publisher_statement",
            "facts_only",
            "permission"
          ]
        },
        "text": {
          "type": "string",
          "minLength": 1
        },
        "checked_at": {
          "$ref": "#/$defs/date"
        },
        "checked_by": {
          "type": "string",
          "minLength": 1
        },
        "evidence_url": {
          "type": "string",
          "minLength": 1
        }
      }
    },
    "source": {
      "type": "object",
      "additionalProperties": false,
      "required": [
        "source_id",
        "role",
        "publisher",
        "product",
        "url",
        "edition",
        "retrieved_at",
        "current_through",
        "inputs",
        "license",
        "rights_basis",
        "publication_mode"
      ],
      "properties": {
        "source_id": {
          "type": "string",
          "pattern": "^[a-z][a-z0-9_]*$"
        },
        "role": {
          "enum": [
            "primary",
            "channel",
            "geometry",
            "reference"
          ]
        },
        "publisher": {
          "type": "string",
          "minLength": 1
        },
        "product": {
          "type": "string",
          "minLength": 1
        },
        "url": {
          "type": "string",
          "minLength": 1
        },
        "edition": {
          "type": "string",
          "minLength": 1
        },
        "retrieved_at": {
          "type": "string",
          "minLength": 1
        },
        "current_through": {
          "anyOf": [
            {
              "$ref": "#/$defs/date"
            },
            {
              "type": "null"
            }
          ]
        },
        "inputs": {
          "type": "array",
          "items": {
            "type": "object",
            "additionalProperties": false,
            "required": [
              "file",
              "bytes",
              "sha256"
            ],
            "properties": {
              "file": {
                "type": "string",
                "minLength": 1,
                "not": {
                  "pattern": "[\\\\/]"
                }
              },
              "bytes": {
                "type": [
                  "integer",
                  "null"
                ],
                "minimum": 0
              },
              "sha256": {
                "$ref": "#/$defs/sha256"
              }
            }
          }
        },
        "license": {
          "$ref": "#/$defs/license"
        },
        "rights_basis": {
          "$ref": "#/$defs/rights_basis"
        },
        "publication_mode": {
          "enum": [
            "open_licence",
            "derived_facts",
            "status_only"
          ]
        }
      }
    },
    "freshness": {
      "type": "object",
      "additionalProperties": false,
      "required": [
        "source_current_through",
        "source_cadence",
        "built_at",
        "next_check"
      ],
      "properties": {
        "source_current_through": {
          "anyOf": [
            {
              "$ref": "#/$defs/date"
            },
            {
              "type": "null"
            }
          ]
        },
        "source_cadence": {
          "enum": [
            "monthly",
            "annual",
            "irregular",
            "static",
            "discontinued"
          ]
        },
        "built_at": {
          "$ref": "#/$defs/datetime_utc"
        },
        "next_check": {
          "anyOf": [
            {
              "$ref": "#/$defs/date"
            },
            {
              "type": "null"
            }
          ]
        }
      },
      "if": {
        "properties": {
          "source_cadence": {
            "enum": [
              "monthly",
              "annual",
              "irregular"
            ]
          }
        }
      },
      "then": {
        "properties": {
          "next_check": {
            "$ref": "#/$defs/date"
          }
        }
      }
    },
    "coverage": {
      "type": "object",
      "additionalProperties": false,
      "required": [
        "geography",
        "frame",
        "n_units_frame",
        "n_units_covered",
        "n_records",
        "known_gaps"
      ],
      "properties": {
        "geography": {
          "type": "string",
          "minLength": 1
        },
        "iso3": {
          "type": "array",
          "minItems": 1,
          "uniqueItems": true,
          "items": {
            "type": "string",
            "pattern": "^[A-Z]{3}$"
          }
        },
        "frame": {
          "anyOf": [
            {
              "type": "null"
            },
            {
              "type": "object",
              "additionalProperties": false,
              "required": [
                "iso3",
                "level"
              ],
              "properties": {
                "iso3": {
                  "type": "string",
                  "pattern": "^[A-Z]{3}$"
                },
                "level": {
                  "enum": [
                    "ADM0",
                    "ADM1",
                    "ADM2"
                  ]
                }
              }
            }
          ]
        },
        "n_units_frame": {
          "type": [
            "integer",
            "null"
          ],
          "minimum": 0
        },
        "n_units_covered": {
          "type": [
            "integer",
            "null"
          ],
          "minimum": 0
        },
        "n_records": {
          "type": "integer",
          "minimum": 0
        },
        "known_gaps": {
          "type": "array",
          "items": {
            "type": "string",
            "minLength": 1
          }
        }
      }
    },
    "release": {
      "type": "object",
      "additionalProperties": false,
      "required": [
        "dataset",
        "version",
        "tag",
        "doi",
        "published_at"
      ],
      "properties": {
        "dataset": {
          "type": "string",
          "pattern": "^abf-[a-z0-9]+$"
        },
        "version": {
          "type": "string",
          "pattern": "^\\d+\\.\\d+\\.\\d+$"
        },
        "tag": {
          "type": "string",
          "pattern": "^abf-[a-z]+-v\\d+\\.\\d+\\.\\d+$"
        },
        "doi": {
          "anyOf": [
            {
              "type": "null"
            },
            {
              "type": "string",
              "pattern": "^10\\.5281/zenodo\\.\\d+$"
            }
          ]
        },
        "published_at": {
          "$ref": "#/$defs/date"
        }
      }
    },
    "verification": {
      "type": "object",
      "additionalProperties": false,
      "required": [
        "levels",
        "method",
        "sample_share",
        "automated_checks"
      ],
      "properties": {
        "levels": {
          "type": "object",
          "additionalProperties": false,
          "properties": {
            "source_as_is": {
              "type": "number",
              "minimum": 0,
              "maximum": 1
            },
            "script_rules": {
              "type": "number",
              "minimum": 0,
              "maximum": 1
            },
            "human": {
              "type": "number",
              "minimum": 0,
              "maximum": 1
            },
            "agent_sample": {
              "type": "number",
              "minimum": 0,
              "maximum": 1
            }
          },
          "required": [
            "source_as_is",
            "script_rules",
            "human"
          ]
        },
        "method": {
          "type": "string",
          "minLength": 1
        },
        "sample_share": {
          "type": "object",
          "additionalProperties": {
            "type": "number",
            "minimum": 0,
            "maximum": 1
          }
        },
        "automated_checks": {
          "type": "array",
          "items": {
            "type": "object",
            "additionalProperties": false,
            "required": [
              "id",
              "description"
            ],
            "properties": {
              "id": {
                "type": "string",
                "pattern": "^[a-z][a-z0-9_]*$"
              },
              "description": {
                "type": "string",
                "minLength": 1
              }
            }
          }
        }
      }
    },
    "citation": {
      "type": "object",
      "additionalProperties": false,
      "required": [
        "text",
        "record_pattern"
      ],
      "properties": {
        "text": {
          "type": "string",
          "minLength": 1
        },
        "record_pattern": {
          "type": "string",
          "pattern": "\\{record_key\\}"
        }
      }
    },
    "display": {
      "type": "object",
      "properties": {
        "geometry_type": {
          "enum": [
            "polygon",
            "line",
            "point"
          ]
        },
        "value_field": {
          "type": "string"
        },
        "unit": {
          "type": "string"
        },
        "breaks": {
          "type": "array",
          "items": {
            "type": "number"
          }
        },
        "zero_class": {
          "type": "boolean"
        },
        "breaks_fixed": {
          "type": "boolean"
        },
        "home_bbox": {
          "type": "array",
          "minItems": 4,
          "maxItems": 4,
          "items": {
            "type": "number"
          }
        },
        "tile_fields": {
          "type": "array",
          "items": {
            "type": "string"
          }
        },
        "legend_title": {
          "type": "string"
        },
        "size_field": {
          "type": "string"
        },
        "size_breaks": {
          "type": "array",
          "items": {
            "type": "number"
          }
        },
        "size_classes": {
          "type": "array",
          "items": {
            "type": "string"
          }
        },
        "legend_note": {
          "type": "string"
        },
        "legend_zero": {
          "type": "string"
        },
        "legend_unknown": {
          "type": "string"
        },
        "legend_point": {
          "type": "string"
        },
        "unit_card_line": {
          "type": "string"
        },
        "map": {
          "type": "boolean"
        },
        "count_field": {
          "type": "string"
        },
        "count_breaks": {
          "type": "array",
          "minItems": 1,
          "items": {
            "type": "number"
          }
        }
      }
    },
    "extra_file": {
      "type": "object",
      "additionalProperties": false,
      "required": [
        "file",
        "description"
      ],
      "properties": {
        "file": {
          "type": "string",
          "minLength": 1
        },
        "description": {
          "type": "string",
          "minLength": 1
        },
        "fields": {
          "type": "array",
          "items": {
            "$ref": "#/$defs/field"
          }
        }
      }
    }
  }
}
